,Date,Title,URL,Journal,Severe,Severe lower bound,Severe upper bound,Severe p-value,Severe Significant,Severe Adjusted,Severe Calculated,Fatality,Fatality lower bound,Fatality upper bound,Fatality p-value,Fatality Significant,Fatality Adjusted,Fatality Calculated,Multivariate adjustment,Design,Sample,Study population,Added on,Critical only,Discharged vs. death?,Sample Text,Matches,Entry
7,2020-03-31,Coronavirus Disease 2019 in elderly patients: characteristics and prognostic factors based on 4-week follow-up,https://doi.org/10.1016/j.jinf.2020.03.019,Journal of Infection,,,,,,,,HR  1.08,1.06,1.11,<0.01,Significant,Not Adjusted,Extracted,,Prospective observational study,339,"age over 60 years old admitted to Renmin Hospital of Wuhan University from Jan 1 to Feb 6, 2020 (followed up until March 5)",4/10/2020,N,N,,,
8,2020-03-31,Coronavirus Disease 2019 in elderly patients: characteristics and prognostic factors based on 4-week follow-up,https://doi.org/10.1016/j.jinf.2020.03.020,Journal of Infection,,,,,,,,AHR 1.06,1.03,1.1,<0.01,Significant,Adjusted,Extracted,"cardiovascular disease, cerebrovascular disease, COPD",Prospective observational study,339,"age over 60 years old admitted to Renmin Hospital of Wuhan University from Jan 1 to Feb 6, 2020 (followed up until March 5)",4/10/2020,N,N,,,
9,2020-03-27,"A New Predictor of Disease Severity in Patients with COVID-19 in Wuhan, China",https://www.medrxiv.org/content/10.1101/2020.03.24.20042119v1.full.pdf,medRxiv,OR 1.06,1.04,1.08,<0.01,Significant,Not Adjusted,Extracted,,,,,,,,,Prospective observational study,377,"Central Hospital of Wuhan from January 1 to February 28, 2021",4/10/2020,N,N,,,
10,2020-03-27,Radiographic Findings and other Predictors in Adults with Covid-19,https://doi.org/10.1101/2020.03.23.20041673,medRxiv,,,,,,,,AOR 1.06,1.01,1.12,0.03,Significant,Adjusted,Extracted,,Retrospective observational study,102,"Tongji Hospital from January 31 to March 5, 2020",4/10/2020,N,N,,,
11,2020-03-26,"Clinical characteristics of COVID-19-infected cancer patients: A retrospective case study in three hospitals within Wuhan, China",https://doi.org/10.1016/j.annonc.2020.03.296,Annals of Oncology,HR 1.46,0.48,4.43,0.51,Not Significant,Not Adjusted,Extracted,,,,,,,,,Retrospective observational study,28,"Tongji Sino-French New Town Hospital, Union Red Cross Hospital and Union West Hospital, all affiliated with the Tongji Medical College of Huazhong University of Science and Technology. Hospitalized cancer patients diagnosed with COVID-9 infection were identified between Jan 13, 2020 and Feb 26, 2020",5/6/2020,Y,N,,,
12,2020-03-24,"Myocardial injury is associated with in-hospital mortality of confirmed or suspected COVID-19 in Wuhan, China: A single center retrospective cohort study",https://doi.org/10.1101/2020.03.21.20040121,medRxiv,,,,,,,Age,HR 1.03,0.98,1.08,0.25,Not Significant,Not Adjusted,Extracted,,Retrospective observational study,110,Patients from Wuhan No.1 Hospital from Dec 25th to Feb 15th.,4/10/2020,N,N,,,
13,2020-03-23,Prognostic value of C-reactive protein in patients with COVID-19,https://doi.org/10.1101/2020.03.21.20040360,medRxiv,OR 1.05,1.02,1.07,<0.01,Significant,Not Adjusted,Extracted,,,,,,,,,Retrospective observational study,298,"Eastern Campus of Renmin Hospital of Wuhan University from Jan 30 to Feb 20, 2022",4/10/2020,N,N,,,
14,2020-03-19,"Clinical progression of patients with COVID-19 in Shanghai, China",https://www.ncbi.nlm.nih.gov/pmc/articles/PMC7102530/,Journal of Infection,AOR 1.06,1.0,1.12,0.05,Not Significant,Adjusted,Extracted,,,,,,,,"Gender, comorbitity, lab findings",Retrospective observational study,249,"Shanghai Public Health Clinical Center (SPHCC) from Jan 20 to Feb 6, 2020, final follow-up Feb 25, 2020",5/6/2020,Y,N,,,
15,2020-03-19,"Clinical progression of patients with COVID-19 in Shanghai, China",https://www.ncbi.nlm.nih.gov/pmc/articles/PMC7102530/,Journal of Infection,OR 1.08,1.04,1.13,<0.01,Significant,Not Adjusted,Extracted,,,,,,,,,Retrospective observational study,249,"Shanghai Public Health Clinical Center (SPHCC) from Jan 20 to Feb 6, 2020, final follow-up Feb 25, 2020",5/6/2020,Y,N,,,
16,2020-03-13,Epidemiological characteristics of confirmed COVID-19 cases in Tianjin,https://doi.org/10.3760/cma.j.cn112338-20200221-00146,Chinese Journal of Epidemiology,AOR 1.04,1.01,1.17,,Significant,Adjusted,Extracted,,,,,,,,"Heart disease, cerebrovascular disease, number of underlying diseases",Cross-sectional study,135,Tianjin from Jan 11-Feb 14,4/10/2020,N,N,,,
17,2020-03-06,Analysis of myocardial injury in patients with COVID-19 and association between concomitant cardiovascular diseases and severity of COVID-19,https://www.ncbi.nlm.nih.gov/pubmed/32141280,Chinese Journal of Cardiovascular Diseases,AOR 1.02,0.96,1.08,0.52,Not Significant,Adjusted,Extracted,,,,,,,,"gender, hypertension, history of heart disease, N-terminal pro-B-type natriuretic peptide, cardiac troponin I, hypersensitive C-reactive protein, blood creatine",Cross-sectional study,150,"Tongji Hospital, excluding those with acute myocardial infarction",4/10/2020,N,N,,,
18,2020-03-06,Analysis of myocardial injury in patients with COVID-19 and association between concomitant cardiovascular diseases and severity of COVID-19,https://www.ncbi.nlm.nih.gov/pubmed/32141280,Chinese Journal of Cardiovascular Diseases,OR 1.06,1.02,1.09,<0.01,Significant,Not Adjusted,Extracted,,,,,,,,,Cross-sectional study,150,"Tongji Hospital, excluding those with acute myocardial infarction",4/10/2020,N,N,,,
19,2020-03-06,Case fatality risk of novel coronavirus diseases 2019 in China,https://doi.org/10.1101/2020.03.04.20031005,medRxiv,,,,,,,,OR 1.18,1.14,1.22,<0.01,Significant,Adjusted,Extracted,,Cross-sectional study,9651,The National Health Commission of China (NHC) and the Chinese Center for Disease Control and Prevention (China CDC),4/10/2020,N,N,,,
20,2020-03-03,"Epidemiological and clinical features of COVID-19 patients with and without pneumonia in Beijing, China",https://www.medrxiv.org/content/10.1101/2020.02.28.20028068v1.full.pdf,medRxiv,,,,,,,,,,,,,,,,Retrospective observational study,55,"Fifth Medical Center of PLA General Hospital from December 27, 2019 to February 18, 2020",5/6/2020,N,N,,,
21,2020-03-03,Epidemiological and clinical features of 2019-nCoV acute respiratory disease cases in Chongqing municipality China: a retrospective descriptive multiple-center study,https://doi.org/10.1101/2020.03.01.20029397,medRxiv,,,,,,,,,,,,,,,,Retrospective observational study,267,"Qianjiang central hospital of Chongqing, Chongqing three gorges central hospital and Chongqing public health medical center from January 19 to February 16, 2021",5/6/2020,N,N,,,
