,Date,Title,URL,Journal,Severe,Severe lower bound,Severe upper bound,Severe p-value,Severe Significant,Severe Adjusted,Severe Calculated,Fatality,Fatality lower bound,Fatality upper bound,Fatality p-value,Fatality Significant,Fatality Adjusted,Fatality Calculated,Multivariate adjustment,Design,Sample,Study population,Added on,Critical only,Discharged vs. death?,Sample Text,Matches,Entry
,2020-08-01,COVID-19 transmission in Mainland China is associated with temperature and humidity: A time-series analysis,https://doi.org/10.1016/j.scitotenv.2020.138778,Science of The Total Environment,,,,,,,,,,,,,,,,Time-to-event analysis,,"Daily counts of laboratory-confirmed cases in all provinces in China were collected from the official reports of the National Health Commission of People's Republic of China from December 1, 2019 to February 11, 2020 for Hubei province and from January 20, 2020 to February 11, 2020 for other provinces.",,,,"This study sought to examine the associations of daily average temperature (AT) and relative humidity (ARH) with the daily counts of COVID-19 cases in 30 Chinese provinces (in Hubei from December 1, 2019 to February 11, 2020 and in other provinces from January 20, 2020 to Februarys 11, 2020).","The IRRs here were 0.78 (95% CI: 0.69-0.89), 0.84 (95% CI: 0.75-0.93), and 0.89 (95% CI: 0.8-1).",2020-05-12
,2020-05-07,Coast-to-Coast Spread of SARS-CoV-2 during the Early Epidemic in the United States,https://doi.org/10.1016/j.cell.2020.04.021,Cell,,,,,,,,,,,,,,,,Other,168.0,"Daily COVID-19 cases from international locations were obtained from the European Centre for Disease Prevention and Control via Our World in Data ( International data were accessed on March 19, 2020.",,,,"The COVID-19 Outbreak in Connecticut Is Phylogenetically Linked to SARS-CoV-2 from Washington (A) We constructed a maximum-likelihood tree using 168 global SARS-CoV-2 protein coding sequences, including 9 sequences from COVID-19 patients identified in Connecticut from March 6-14, 2020.", : 0.092 (95% CI = 0.05-0.20).,2020-05-12
,2020-05-06,Impact of policy interventions and social distancing on SARS-CoV-2 transmission in the United States,https://doi.org/10.1101/2020.05.01.20088179,medrxiv,,,,,,,,,,,,,,,,Case series,500.0,"In order to retrospectively analyze metrics of disease spread and mortality, case and death data were compiled up to April 30th, 2020 from the COVID-19 time series made available by The New York Times.",,,,The primary outcomes were average Rt in the week following 500 cases and doubling time from 500 to 1000 cases.,"(ß = -0.15, 95% CI -0.23 to -0.07, p < 0.001, Table 2 ).",2020-05-12
,2020-05-05,Risk Factors of the Severity of COVID-19: A Meta-Analysis,https://doi.org/10.1101/2020.04.30.20086744,medrxiv,,,,,,,,,,,,,,,,Systematic review,2272.0,"Both of the authors searched through PubMed, Google Scholar, EMBASE, and Cochrane Library using keywords:",,,,We have extracted 2272 patients' information from 10 autonomous studies 14-23 and incorporated them into this research.,"This study found sex (male) (Risk ratio [RR] =1.29, 95% CI, 1.07 to 1.54), hypertension (RR=1.79, 95% CI, 1.57 to 2.04), diabetes (RR=1.57, 95% CI, 1.25 to 1.98), fatigue or myalgia (RR=1.17, 95% CI, 1.02; 1.35), and smoking history (RR=1.71, 95% CI,1.25; 2.35) are potential risk factors for the severity of COVID-19.

We found fever (RR=1.21, 95% CI, 0.66 to 2.22), cough (1.13, 95% CI, 0.98 to 1.30), and diarrhea (RR=1.14, 95% CI, 0.93 to 1.40) as insignificant risk factors for COVID-19 severity.",2020-05-12
,2020-05-05,"Obstructive Sleep Apnea, Obesity, and Noninvasive Ventilation: Considerations During the Coronavirus Disease 2019 Pandemic",https://www.ncbi.nlm.nih.gov/pmc/articles/PMC7202104/,Anesth Analg,,,,,,,,,,,,,,,,Retrospective observational,6000000.0,"2 These characteristics are corroborated with preliminary data from the Italian COVID-19 outbreak which describe the typical COVID-19 patient as age 60-70, men, and obese.",,,,"12 In a large retrospective cohort study of over 6,000,000 cases, sleep apnea has been associated with an increased risk for the development of ARDS among patients undergoing orthopedic and general surgical procedures.","During the influenza A(H1N1) pandemic in 2009, obesity was found to be an independent risk factor for complications related to influenza.9,10 A retrospective analysis of BMI stratified by age in symptomatic patients with COVID-19 who presented to a large academic hospital system in New York has shown that patients aged <60 years with a BMI between 30 and 34kg/m2 were 2.0 (95% confidence interval [CI], 1.6–2.6, P < .0001) and 1.8 (95% CI, 11.2–2.7, P = .006) times more likely to be admitted to acute and critical care, respectively, than those with a BMI <30 kg/m2.11 Likewise, patients with a BMI >35 kg/m2 and aged <60 years were 2.2 (95% CI, 11.7–2.9, P<.0001) and 3.6 (95% CI, 22.5–5.3, P ≤.0001) times more likely to be admitted to acute and critical care than patients in the same age category who had BMI <30 kg/m2.11

11 Likewise, patients with a BMI >35 kg/m 2 and aged <60 years were 2.2 (95% CI, 11.7-2.9, P < .0001) and 3.6 (95% CI, 22.5-5.3, P ≤ .0001) times more likely to be admitted to acute and critical care than patients in the same age category who had BMI <30 kg/m 2 .

9,10 A retrospective analysis of BMI stratified by age in symptomatic patients with COVID-19 who presented to a large academic hospital system in New York has shown that patients aged <60 years with a BMI between 30 and 34 kg/m 2 were 2.0 (95% confidence interval [CI], 1.6-2.6, P < .0001) and 1.8 (95% CI, 11.2-2.7, P = .006) times more likely to be admitted to acute and critical care, respectively, than those with a BMI <30 kg/m 2 .",2020-05-12
,2020-05-05,ai-corona: Radiologist-Assistant Deep Learning Framework for COVID-19 Diagnosis in Chest CT Scans,https://doi.org/10.1101/2020.05.04.20082081,medrxiv,,,,,,,,,,,,,,,,Other,2121.0,"Respiratory samples including pharyngeal swabs/washing were obtained from February 20 th till April 3 rd , 2020, from the hospitalized patients.",,,,"Method: Our dataset comprises 2121 cases of axial spiral chest CT scans in three classes; COVID-19 abnormal, non COVID-19 abnormal, and normal, from which 1764 cases were used for training and 357 cases for validation.","ai-corona achieves an AUC score of 0.989 (95% CI: 0.984, 0.994), 0.997 (95% CI: 0.995, 0.999), 0.986 (95% CI: 0.981, 0.991), 0.959 (95% CI: 0.944, 0.974), 0.978 (95% CI: 0.968, 0.988), and 0.961 (95% CI: 0.951, 0.971) in each combination, respectively.",2020-05-12
,2020-05-02,Modifiable and non-modifiable risk factors for COVID-19: results from UK Biobank,https://doi.org/10.1101/2020.04.28.20083295,medrxiv,,,,,,,,,,,,,,,,Case series,1474.0,March 2020 to 14th April 2020.,,,,"Results were available for 2,724 tests conducted on 1,474 individuals.","Other risk factors included older age (RR 1.10 per 5 year increase (95% CI 1.02-1.36)), male sex (RR 1.64 (95% CI 1.25-2.14)), black ethnicity (RR 1.86 (95% CI 1.03, 3.36)), All rights reserved.

Other risk factors were older age (RR 1.15 per 5 years (95% CI 1.08-1.24)), male sex (RR 1.54 (95% CI 1.24-1.91)), black ethnicity (RR 2.07 (95% CI 1.16, 3.71)), socioeconomic deprivation (RR 1.35 per SD increase in Townsend Index (95% CI 1.23-1.49)).

  socioeconomic deprivation (RR 1.26 (95% CI 1.14-1.40)), longstanding illness (RR 1.38 (95% CI 1.09-1.74)), lower HDL-cholesterol (RR 0.82 (95% CI 1.72-0.95)) and higher cystatin C (RR 1.24 (95% CI 1.12-1.37)) ( Table 2) .",2020-05-12
,2020-05-01,"Racial, Economic and Health Inequality and COVID-19 Infection in the United States",https://doi.org/10.1101/2020.04.26.20079756,medrxiv,,,,,,,,,,,,,,,,Cross-sectional,1981.0,"Data source: Data sources in this study include, 1) publicly available data from USAfacts and the US Census Bureau for COVID-19 cases and county-level demographic data, 9, 10 2) COVID-19 data reported by each state on their department of health websites, 9 3) State Population by Race/Ethnicity data, 11, 12 and 4) mobility data extracted from Google.",,,,"African Americans were more vulnerable to COVID-19 than other ethnic groups (1,981 African American infected cases versus 658 Whites per million).","CI: -0.41, -0.12, q<0.003).",2020-05-12
,2020-04-28,"Features of 16,749 hospitalised UK patients with COVID-19 using the ISARIC WHO Clinical Characterisation Protocol",https://doi.org/10.1101/2020.04.23.20076042,medrxiv,,,,,,,,,,,,,,,,Prospective observational,16749.0,"Clinical information from the routine health records of people admitted to 166 hospitals in England Wales and Scotland with proven SARS-CoV-2 infection were extracted into deidentified case report forms on a REDCap database (Research Electronic Data Capture, Vanderbilt University (USA) hosted by University of Oxford (UK), by 2,468 research nurses, administrators and volunteer medical students.",,,,"Between 6 th February and 14:00 on 18 th April 2020, CCP-UK recruited 16,749 patients admitted to hospital with COVID-19 in England, Scotland and Wales.","Increased age was a strong predictor of in-hospital mortality after adjusting for comorbidity ( figure 6 ): (reference age<50yrs) 50-69yrs Hazard ratio (HR) 4.02 (Confidence interval (CI) 2.88, 5.63, p<0.001), 70-79yrs HR 9.59 (CI 6.89, 13.34, p<0.001), >=80yrs HR 13.59 (CI 9.79, 18.85, p<0.001).

Female sex was associated with lower mortality HR 0.80 (CI 0.72, 0.89, p<0.001).",2020-05-01
,2020-04-28,"Baseline Characteristics and Outcomes of 1591 Patients Infected With SARS-CoV-2 Admitted to ICUs of the Lombardy Region, Italy",https://jamanetwork.com/journals/jama/articlepdf/2764365/jama_grasselli_2020_oi_200037.pdf,JAMA,,,,,,,,,,,,,,,,Case series,1591.0,Data were recorded by the coordinator center on an electronic worksheet during telephone calls by the staff of the COVID-19 Lombardy ICU Network.,,,,"RESULTS: Of the 1591 patients included in the study, the median (IQR) age was 63 (56-70) years and 1304 (82%) were male.","Older patients (n = 786; age ≥64 years) had higher mortality than younger patients (n = 795; age ≤63 years) (36% vs 15%; difference, 21% [95% CI, 17%-26%]; P < .001).

The median PEEP level was not different between younger patients (n = 503 aged ≤63 years) and older patients (n = 514 aged ≥64 years) (14 [IQR, 12-15] vs 14 [IQR, 12-16] cm H O, respectively; median difference, 0 [95% CI, 0-0]; P = .94).

Patients with hypertension (n = 509) were older than those without hypertension (n = 526) (median [IQR] age, 66 years [60-72] vs 62 years [54-68]; P < .001) and had lower Pao /Fio (median [IQR], 146 [105-214] vs 173 [120-222]; median difference, −27 [95% CI, −42 to −12]; P = .005).",2020-05-12
,2020-04-28,Association of Digestive Symptoms and Hospitalization in Patients with SARS-CoV-2 Infection,https://doi.org/10.1101/2020.04.23.20076935,medrxiv,,,,,,,,,,,,,,,,Other,2.0,"Methods: Following expedited approval from our Institutional Review Board, we analyzed retrospectively collected data from consecutive patients with confirmed COVID-19 based on a positive polymerase chain reaction testing at our institution from March 03, 2020 to April 7, 2020.",,,,Respiratory viral co-infection was found in 14 of 146 (9.1%) tested patients; of whom two patients were hospitalized and three patients had digestive symptoms.,"(adjusted OR 4.39, 95% CI: 1.61-11.4, P = 0.005).",2020-05-01
,2020-04-26,COVID-19 Epidemic in Algeria: Assessment of the implemented preventive strategy,https://doi.org/10.1101/2020.04.21.20074443,medrxiv,,,,,,,,,,,,,,,,Modeling,15613.0,"We collected data on preventive and control actions, implementation dates and confirmed COVID-19 cases number from official reports of governmental institutions and official media in Algeria (Algerian Ministry of Health, 2020; APS, 2020).",,,,"Our projection revealed that 15613 cases of COVID-19 were avoided in 14 days, from April 6, to April 19, 2020, in the whole country, and 1747 cases were prevented in Blida during the same period.",", the results are R0-befor=1,69 (95% CI 1,49-1,88) and R0-after=1,14 (95% CI 1,10-1,18), the p value was <10 -5 .

, the results show R0-befor=2,18 (95% CI 1,87-2,49) and R0-after=1,31 (95% CI 1,28-1,39), with p value <5 10 -4 .",2020-05-01
,2020-04-25,COVID-19 Fatality and Comorbidity Risk Factors among Confirmed Patients in Mexico,https://doi.org/10.1101/2020.04.21.20074591,medrxiv,,,,,,,,,,,,,,,,Other,7497.0,"In this paper we estimate fatality risks based on survival analysis methods, calculated from individual-level data on symptomatic patients confirmed with COVID-19 recently released by the Mexican Ministry of Health.",,,,"Our analysis is based on 7,497 patients who tested positive for COVID-19 in Mexico, a subset of a larger dataset of 49,167 patients with COVID-19 related symptoms who sought attention in medical units and were tested with positive, negative (29,301 cases) and pending (12,369 cases) results.","Compared to a patient between 45-49 years of age, the estimated hazard of death is 161% higher for a patient with 70+ years (HR=2.608, 95% CI 1.931-3.522) and 96% lower for a patient under 25 years (HR=0.038, 95% CI 0.005-0.270).

Even after controlling by age and comorbidities, the estimated death hazard is 59% higher for males (HR=1.589, 95% CI 329-899).

The risk is higher for males (14.72%, 95% CI: 13.27-16.31) than females (9.09%, 95% CI: 7.86-10.49).

In contrast, high blood pressure increases the estimated hazard by 38% (HR=1.378, 95% CI: 1.086-1.749), immune suppression by 70% (HR=1.696, 95% CI: 1.148-2.505), diabetes by 73% (HR=1.730, 95% CI: 36.0-120.2), COPD by 77% (HR=1.770, 95% CI: 1.269-2.469), obesity by 78% (HR=1.776, 95% CI: 1.415-2.231), and chronic liver disease by 168% (HR=2.679, 95% CI: 1.789-4.014).

The estimated death risk after 35 days (Table 2) is 12.38% (95% CI: 11.37-13.47).",2020-05-01
,2020-04-25,Chest computed tomography (CT) scan findings in patients with COVID-19: a systematic review and meta-analysis,https://doi.org/10.1101/2020.04.22.20075382,medrxiv,,,,,,,,,,,,,,,,Systematic review,40.0,"We searched the Web of Science, Ovid, Science Direct, Scopus, EMBASE, PubMed/Medline, Cochrane Library, EBSCO, CINAHL and Google scholar databases.",,,,"Results: Finally, 40 eligible studies with 4,183 patients with COVID-19 were used for meta-analysis.",The mean age of the study participants was 50.52 years (95% CI: 50.87-52.17).,2020-05-01
,2020-04-25,Forecasting the Impact of Coronavirus Disease During Delivery Hospitalization: An Aid for Resources Utilization,https://doi.org/10.1016/j.ajogmf.2020.100127,American Journal of Obstetrics & Gynecology MFM,,,,,,,,,,,,,,,,Modeling,860475.0,We generated daily forecast for the reported incidence of COVID-19 in the US from 4/15/2020 -138 12/31/2020 based on the incidence data from 3/1/2020 -4/14/2020.,,,,"33 Results: From 3/1/2020 -12/31/2020, our model forecasted a total of 860,475 cases of COVID-34 19 in general population across the United States.","Among those, 3,308 (95% CI, 1,755 – 4,861) cases are expected to be severe, 681 (95% CI, 1324 – 1,038) critical and 52 (95% CI, 23 – 81) maternal mortality.

36 Among those, 3,308 (95% CI, 1,755 -4,861) cases are expected to be severe, 681 (95% CI, 1324 37 -1,038) critical and 52 (95% CI, 23 -81) maternal mortality.",2020-05-01
,2020-04-24,Higher mortality in men from COVID19 infection-understanding the factors that drive the differences between the biological sexes.,https://doi.org/10.1101/2020.04.19.20062174,medrxiv,,,,,,,,,,,,,,,,Retrospective observational,3.0,looking at cases from Saudi Arabia and South Korea 7 .,,,,"The table 1 below is based on three studies from China 4,5 .","Females 95% Score CI 95% CI p-value .

The odds ratio of male mortality was also higher, at 1.85-95% CI (1.43-2.3) from SARS-CoV 9,10 .",2020-05-01
,2020-04-22,Effectiveness and Safety of Glucocorticoids to Treat COVID-19: A Rapid Review and Meta-Analysis,https://doi.org/10.1101/2020.04.17.20064469,medrxiv,,,,,,,,,,,,,,,,Systematic review,17.0,World Health Organization 2020,,,,"One study included adult patients with severe MERS, 17 studies included patients with SARS, and the remaining five studies were on patients with COVID-19 (Table 1) .","(WMD=0.95 days, 95% CI: -7.57 to 9.48, I²=94.6%).",2020-05-01
,2020-04-20,Knowledge and practice of preventive measures against COVID-19 infection among pregnant women in a low-resource African setting,https://doi.org/10.1101/2020.04.15.20066894,medrxiv,,,,,,,,,,,,,,,,Cross-sectional,284.0,"Materials and Methods: This was a self-administered questionnaire-based cross-sectional study conducted from February 1, 2020 to March 31, 2020 among 284 antenatal clinic attendees at Alex Ekwueme Federal University Teaching Hospital, Abakaliki, Ebonyi State.",,,,"However, 284 women were recruited for the study.","Variable Age (years)  Practice COR(95% CI) p value AOR(95% CI) p value

Variable Age (years)  Knowledge COR(95% CI) p value AOR(95% CI) p value

Variable Married Practice 56 168 COR(95% CI) 2.44 (1.10 - 5.38) p value 0.027 AOR(95% CI) 2.99 (1.40 - 6.33) p value  0.035

Variable Married Knowledge 140 84 COR(95% CI) 0.42 (0.19 - 0.93) p value 0.032 AOR(95% CI) 0.76 (0.56 - 1.72) p value  0.151

Variable Marital status  Practice COR(95% CI) p value AOR(95% CI) p value

Variable Marital status  Knowledge COR(95% CI) p value AOR(95% CI) p value

Variable Husband's educational  Practice COR(95% CI) p value AOR(95% CI)

Variable Husband's educational  Knowledge COR(95% CI) p value AOR(95% CI)

Variable Parity  Practice COR(95% CI) p value AOR(95% CI) p value

Variable Unemployed Practice 16 9 COR(95% CI) 1.00 p value AOR(95% CI) 1.00  p value

Variable Occupation  Practice COR(95% CI) p value AOR(95% CI) p value

Variable Widowed Practice 12 7 COR(95% CI) 0.47 (0.14 - 1.55) p value 0.217  AOR(95% CI) p value

Variable Divorced Practice 5 7 COR(95% CI) 1.14 (0.29 - 4.43) p value 0.853  AOR(95% CI) p value

Variable Rural Practice 25 86 COR(95% CI) 1.86 (1.08 - 3.19) p value 0.026 AOR(95% CI) 2.08 (1.32 - 4.05) p value  0.031

Variable Unemployed Knowledge 10 15 COR(95% CI) 1.00 p value AOR(95% CI) 1.00  p value

Variable ≥ 5 Practice 17 40 COR(95% CI) 2.53 (1.17 - 5.47) p value 0.019 AOR(95% CI) 3.11(1.32 - 6.56) p value  0.021

Variable Practice (n=86)  (n=198)  COR(95% CI) p value AOR(95% CI) p value

Variable > 40 Practice 16 21 COR(95% CI) 0.68 (0.32 - 1.44) p value 0.312  AOR(95% CI) p value

Variable < 30 Practice 43 83 COR(95% CI) 1.00 p value AOR(95% CI) 1.00  p value

Variable 31 - 40 Practice 27 94 COR(95% CI) 1.80 (1.03 - 3.17) p value 0.041 AOR(95% CI) 2.04 (1.26 - 5.37) p value  0.022

Variable 2-4 Practice 19 93 COR(95% CI) 5.26 (2.56 - 10.79) p value <0.001 AOR(95% CI) 4.01 (0.55 - 6.88) p value  0.601

Variable 1 Practice 21 38 COR(95% CI) 1.94 (0.92 - 4.10) p value 0.081  AOR(95% CI) p value

Variable 0 Practice 29 27 COR(95% CI) 1.00 p value AOR(95% CI) 1.00  p value

Variable Occupation  Knowledge COR(95% CI) p value AOR(95% CI) p value

Variable Parity  Knowledge COR(95% CI) p value AOR(95% CI) p value

Variable Widowed Knowledge 15 4 COR(95% CI) 0.19 (0.05 - 0.71) p value 0.014 AOR(95% CI) 0.39 (0.63 - 1.85) p value  0.413

Variable Rural Knowledge 32 79 COR(95% CI) 10.88 (6.20 - 19.08) p value <0.001 AOR(95% CI) 9.11 (5.67 - 20.01) p value  <0.001

Variable Urban Practice 61 112 COR(95% CI) 1.00 p value AOR(95% CI) 1.00  p value

Variable Divorced Knowledge 6 6 COR(95% CI) 0.71 (0.18 - 2.73) p value 0.614  AOR(95% CI) p value

Variable ≥ 5 Knowledge 51 6 COR(95% CI) 0.16 (0.05 - 0.43) p value <0.001 AOR(95% CI) 0.24 (0.21 - 0.87) p value  0.002

Variable Knowledge (n=173)  (n=111)  COR(95% CI) p value AOR(95% CI) p value

Variable > 40 Knowledge 43 10 COR(95% CI) 0.25 (0.12 - 0.54) p value <0.001 AOR(95% CI) 0.19 (0.23 - 0.65) p value  <0.001

Variable < 30 Knowledge 76 70 COR(95% CI) 1.00 p value AOR(95% CI) 1.00  p value

Variable 31 - 40 Knowledge 54 31 COR(95% CI) 0.62 (0.36 - 1.08) p value 0.091  AOR(95% CI) p value

Variable 2-4 Knowledge 41 71 COR(95% CI) 2.31 (1.20 - 4.44) p value 0.012 AOR(95% CI) 1.01 (0.40 - 5.88) p value  0.425

Variable 1 Knowledge 49 10 COR(95% CI) 0.27 (0.11 - 0.64) p value 0.003 AOR(95% CI) 0.89 (0.22 - 3.45) p value  0.491

Variable 0 Knowledge 32 24 COR(95% CI) 1.00 p value AOR(95% CI) 1.00  p value

Variable Urban Knowledge 141 32 COR(95% CI) 1.00 p value AOR(95% CI) 1.00  p value

Variable No formal education Practice 6 10 COR(95% CI) 2.93 (0.95 - 9.03) p value 0.061  AOR(95% CI) p value

Variable No formal education Practice 5 24 COR(95% CI) 7.35 (2.54 - 21.25) p value <0.001 AOR(95% CI) 6.73 (2.66 - 18.34) p value  0.002

Variable Secondary Practice 19 88 COR(95% CI) 7.09 (3.64 - 13.81) p value < 0.001 AOR(95% CI) 3.68 (0.87 - 6.44) p value  0.051

Variable Secondary Practice 16 83 COR(95% CI) 2.13 (1.42 - 5.87) p value 0.05  AOR(95% CI) p value

Variable Educational attainment  Practice COR(95% CI) p value AOR(95% CI) p value

Variable level  Practice COR(95% CI) p value AOR(95% CI) p value

Variable No formal education Knowledge 5 11 COR(95% CI) 1.03 (1.55 - 16.28) p value 0.047 AOR(95% CI) 1.11 (1.69 - 18.20) p value  0.055

Variable No formal education Knowledge 4 25 COR(95% CI) 50.6 (44.07 - 67.39) p value <0.001 AOR(95% CI) 6.30 (2.55 - 6.91) p value  0.004

Variable Area of residence  Practice COR(95% CI) p value AOR(95% CI) p value",2020-04-24
,2020-04-17,Flattening-the-curve associated with reduced COVID-19 case fatality rates- an ecological analysis of 65 countries,https://doi.org/10.1016/j.jinf.2020.04.007,Journal of Infection,,,,,,,,,,,,,,,,Case series,,Dramatic interventions to increase hospital capacity in Wuhan were associated with a subsequent decline in the case fatality rate in this city.,,,,The most recent data available as of 29 March 2020 was used.,"−0.003, 95% CI −0.004-−0.002; Table 1 ).",2020-05-01
,2020-04-17,"Knowledge, attitude, practice and perceived barriers among healthcare professionals regarding COVID-19: A Cross-sectional survey from Pakistan",https://doi.org/10.1101/2020.04.13.20063198,medrxiv,,,,,,,,,,,,,,,,Cross-sectional,414.0,Participants from all healthcare professions were selected for the pilot study.,,,,"(Table II) Of 414 participants, 88.7% (n=367) had positive practice (score=5-6) in following precautions to avoid COVID-19.","Similarly, age group of 31-39 years (OR: 1.377, 95% CI: 0.14-2.04, P=0.05), .

OR: Odds ratio, CI: Confidence interval.

Similarly, age group of 31-39 years (OR: 1.377, 95% CI: 0.14-2.04, P=0.05), experience of more than 5 years (OR: 10.71, 95% CI: 2.83-40.75, P<0.001), and pharmacist job (OR: 2.247, 95% CI: 1.11-4.55, P=0.025) were the substantial determinants of good practice regarding COVID-19.",2020-04-24
,2020-04-16,"Characteristics and outcomes of a cohort of SARS-CoV-2 patients in the Province of Reggio Emilia, Italy",https://doi.org/10.1101/2020.04.13.20063545,medrxiv,,,,,,,,,,,,,,,,Prospective observational,2653.0,"All 2653 symptomatic patients who tested positive for SARS-CoV-2 from February 27 to April 2, 2020 in the province of Reggio Emilia.",,,,"The cohort includes 2653 SARS-CoV-2 patients, representing all the resident symptomatic patients found positive at PCR from February 27 to April 2, 2020.","Patients over age 80 compared to < age 50 had HR 7.1 (95% CI 5.4 to 9.3) and HR 27.8 (95% CI 12.5 to 61.7) for hospitalization and death, respectively.

After adjusting for age and comorbidities, men had a higher risk of hospitalization (hazard ratio (HR) 1.4 95% confidence interval (95% CI) 1.2 to 1.6) and of death (HR 1.6, 95% CI 1.2 to 2.1).",2020-04-24
,2020-04-14,Spread of SARS-CoV-2 in the Icelandic Population,https://www.ncbi.nlm.nih.gov/pmc/articles/PMC7175425/,N Engl J Med,,,,,,,,,,,,,,,,Other,564.0,The targeted testing began on January 31 2020 and focused on individuals deemed at highrisk of being infected by SARS-CoV-2.,,,,"Of the 564 children under the age of 10 years in the targeted testing group, 38 (6.7%) tested positive, in contrast to positive test results in 1183 of 8635 persons who were 10 years of age or older (13.7%).",The age odds ratio is 1.08 per year (95% CI: 1.05-1.12) and the male sex odds ratio is 1.45 (95% CI: 1.04-2.0).,2020-05-12
,2020-04-14,Analysis of factors associated early diagnosis in coronavirus disease 2019 (COVID-19),https://doi.org/10.1101/2020.04.09.20059352,medrxiv,,,,,,,,,,,,,,,,Case series,315.0,"Methods All suspected patients with COVID-19 were included in our study until Feb 9th, 2020.",,,,"Results In total, 315 hospitalized patients were included.","The AUC of patients age, contact history with confirmed people and the decreased lymphocytes were 0.66 (95% CI 0.60-0.73), 0.67 (95% CI 0.61-0.73), 0.62 (95% CI 0.56-0.69), respectively.

The age threshold to predict COVID-19 was 41.5 years, with a diagnostic sensitivity of 0.70 (95% CI 0.61-0.79) and a specificity of 0.59 (95% CI 0.52-0.66).",2020-05-01
,2020-04-12,Risk factors for severity and mortality in adult COVID-19 inpatients in Wuhan,https://doi.org/10.1016/j.jaci.2020.04.006,Journal of Allergy and Clinical Immunology,,,,,,,,,,,,,,,,Case series,549.0,"Methods Patients with COVID-19 admitted to Tongji Hospital from January 26, 2020 to February 5, 2020 were retrospectively enrolled and followed-up until March 3, 2020.",,,,"A total of 549 patients with COVID-19 were enrolled, of whom 548 cases were included in the 219 study.","In the final logistic regression model, variables such as age 65 or older (OR 2.2; 95% CI 1.5-3.5), 292 hypertension (OR 2.0; 95% CI 1.3-3.2), LDH >445 U/L (OR 4.4; 95% CI 2.6-7.6), and 293 d-dimer >1 mg/L (OR 2.2; 95% CI 1.4-3.3) were significantly associated with severe cases with 294 COVID-19 ( Figure 1) .",2020-04-17
