,Date,Study,Study Link,Journal,Study Type,Factors,Influential,Excerpt,Measure of Evidence,Added on,Sample,Sample Text,Matches,Entry
,2020-03-19,A COVID-19 Epidemiological Model for Community and Policy Maker Use,https://doi.org/,ArXiv,Modeling,,,,,,1700,"During the initial spread of the disease, there is one death per 1700 cases, indicating that the epidemic may be underestimated even more when it spreads rapidly.",First the effect of effectiveness of the social distancing intervention is calculated.,2020-05-12
,2020-03-16,Impact of self-imposed prevention measures and short-term government intervention on mitigating and delaying a COVID-19 epidemic,https://doi.org/10.1101/2020.03.12.20034827,medrxiv,Modeling,,,,,,10,"In the main analyses, government-imposed social distancing was 179 initiated when 10 individuals got diagnosed and was lifted after 3 months.",Short-term government-imposed social distancing 160 Governments may decide to promote social distancing policies through interventions such as school and workplace 161 closures or by issuing a ban on large gatherings.,2020-04-03
,2020-03-16,COVID-19: The First Public Coronavirus Twitter Dataset,https://doi.org/,ArXiv,Other,,,,,,,"In this paper, we describe a multilingual coronavirus (COVID-19) Twitter dataset that we have been continuously collecting since January 22, 2020.","Social distancing measures, travel bans, self-quarantines, and business closures are changing the very fabric of societies worldwide.",2020-05-01
,2020-03-15,"Day Level Forecasting for Coronavirus Disease (COVID-19) Spread: Analysis, Modeling and Recommendations",https://doi.org/,ArXiv,Modeling,,,,,,10000,"-During 13 days from 18/2/2020 to 1/3/2020, the cases jumped from 1000 to 10000 cases outside China.","The restrictions on travel and public gatherings, and closing of schools, universities, and workplaces (""Social Distancing"") is the current possible way to decrease E and P.",2020-05-01
,2020-03-13,"The 2019 coronavirus: Learning curves, lessons, and the weakest link",https://doi.org/10.1111/ijcp.13488,Int J Clin Pract,Other,,,,,,72,"54, 55 In Italy, even though entry screening was conducted at two international airports, none of the 72 individuals, including four probable SARS cases, that were admitted for clinical evaluation, were referred to the hospitals by airport authorities.","Quarantines are one of the non-pharmaceutical interventions, which also include personal hygiene measures, cancellation of mass gatherings and public events, school and workplace closure, and travel restrictions.",2020-04-24
,2020-03-13,The Impact of School Closure for COVID-19 on the US Healthcare Workforce and the Net Mortality Effects,https://doi.org/10.1101/2020.03.09.20033415,medrxiv,Other,,,,,,1000000,"10 We use the recent dataset, which includes information on just over 3 million individuals spread across 1.25 million households between January 2018-2020.","Social distancing, including school closures, can limit COVID-19 cases.",2020-03-27
,2020-03-12,"The effect of control strategies that reduce social mixing on outcomes of the COVID-19 epidemic in Wuhan, China",https://doi.org/10.1101/2020.03.09.20033050,medrxiv,Modeling,,,,,,200,"Each simulation started with 200 or 2000 infectious individuals + , 16 with the rest of the population being in the susceptible state.","Extreme social distancing measures, including school closures, workplace closures, and avoiding any public gatherings all at once, can push the transmission to households leading to increased clustering in .",2020-03-27
0,2020-03-25,"The effect of control strategies to reduce social mixing on outcomes of the COVID-19 epidemic in Wuhan, China: a modelling study The Lancet Public Health",https://doi.org/10.1016/S2468-2667(20)30073-6,Lancet Pub Health,Modeling Study,Effectiveness of workplace distancing to prevent secondary transmission in health care and community settings,Y,"92% reduction in infections (IQR 66–97) and 24% (13–90) in mid-2020 and end-2020,",countries: China; cities: Wuhan,04/10/2020,,,,
1,2020-03-23,Interventions to mitigate early spread of SARS-CoV-2 in Singapore: a modelling study The Lancet Infectious Diseases,https://doi.org/10.1016/S1473-3099(20)30162-6,Lancet Infect Dis,Modeling Study,Effectiveness of workplace distancing to prevent secondary transmission in health care and community settings,Y,"Before: R0 = 1.5 270,000 people infected (7.4% population) After: 4,000 infected",cities: Singapore,04/08/2020,,,,
2,2020-03-23,The Effectiveness of Social Distancing in Mitigating COVID-19 Spread: a modelling analysis medrxiv,https://doi.org/10.1101/2020.03.20.20040055,medRxiv,Modeling Study,Effectiveness of workplace distancing to prevent secondary transmission in health care and community settings,Y,"Before: 66% infection rate (179,788 infected individuals)  - no activation delay After: 50% Workplace Non-attendance (WN) : 58.77% IR (160,085) 90% WN: 48.89% IR (133,181) ",countries: Australia; cities: Newcastle,04/08/2020,,,,
3,2020-03-19,SOCRATES: An online tool leveraging a social contact data sharing initiative to assess mitigation strategies for COVID-19,https://doi.org/10.1101/2020.03.03.20030627,medRxiv,Modeling Study,Effectiveness of workplace distancing to prevent secondary transmission in health care and community settings,Y,a predicted 10% decrease in R0 with a telework proportion of 50%.,"countries: Belgium, Finland, Germany, Italy, Luxembourg, Netherlands, Poland, France, Hong Kong, China, Peru, Zimbabwe, Zambia, South Africa, Vietnam, UK",04/30/2020,,,,
4,2020-02-11,Spatially Explicit Modeling of 2019-nCoV Epidemic Trend based on Mobile Phone Data in Mainland China,https://doi.org/10.1101/2020.02.09.20021360,medRxiv,Modeling Study ,Effectiveness of workplace distancing to prevent secondary transmission in health care and community settings,Y,"Current trend maintained: 72,172 infected Resumption of work: 149,774 infected ",countries: China ,04/15/2020,,,,
